{
  "apiVersion": "ahra.dev/v1alpha1",
  "kind": "GoalExecutionRequest",
  "metadata": {
    "idempotencyKey": "TASK-0040-MODE-B-R01",
    "name": "TASK-0040-MODE-B-R01",
    "requestId": "TASK-0040-MODE-B-R01"
  },
  "spec": {
    "artifactDir": "D:\\ahra-v0.1-starter\\work\\tasks\\TASK-0040\\evidence\\real-agent-pilot\\mode-b\\run-01\\.ahra\\artifacts",
    "execution": {
      "branch": "main",
      "maxConcurrency": 1,
      "maxRepairCycles": 0
    },
    "executor": {
      "adapterRef": "executor/bounded-task-agent-driver@sha256:6666666666666666666666666666666666666666666666666666666666666666"
    },
    "gateRunner": {
      "adapterRef": "gate-runner/deterministic@sha256:dddddddddddddddddddddddddddddddddddddddddddddddddddddddddddddddd"
    },
    "goal": {
      "claimGraphDigest": "sha256:6666666666666666666666666666666666666666666666666666666666666666",
      "claimGraphRef": "claim-graph/m1-generic-smoke",
      "goalDigest": "sha256:5555555555555555555555555555555555555555555555555555555555555555",
      "goalRef": "GOAL-M1-GENERIC-SMOKE",
      "requiredClaimRefs": [
        "CLM-GOAL-COMPLETE",
        "CLM-WRITE-ARTIFACT"
      ]
    },
    "planDraft": {
      "apiVersion": "ahra.dev/v1alpha1",
      "kind": "PlanDraft",
      "metadata": {
        "goalId": "GOAL-M1-GENERIC-SMOKE",
        "proposedBy": "planner/inline-plan-draft@sha256:bbbbbbbbbbbbbbbbbbbbbbbbbbbbbbbbbbbbbbbbbbbbbbbbbbbbbbbbbbbbbbbb"
      },
      "spec": {
        "nodes": [
          {
            "budgetRequest": {
              "maxCostUsd": 0.0,
              "maxModelCalls": 2,
              "maxSpawnedNodes": 0,
              "maxToolCalls": 1,
              "maxWallSeconds": 60
            },
            "capabilityRequests": [
              {
                "capability": "filesystem.write",
                "resources": [
                  "outputs/summary.txt"
                ]
              }
            ],
            "claimRefs": [
              "CLM-WRITE-ARTIFACT"
            ],
            "dependsOn": [],
            "expectedOutputs": [
              {
                "artifactRequired": true,
                "consumerNodeRefs": [
                  "NODE-goal-verification"
                ],
                "name": "deterministic-artifact",
                "schemaRef": "schema/m1-deterministic-artifact@sha256:8888888888888888888888888888888888888888888888888888888888888888"
              }
            ],
            "gateRefs": [
              "GATE-write-artifact"
            ],
            "id": "NODE-write-artifact",
            "inputRefs": [
              "input/m1-generic-smoke@sha256:7777777777777777777777777777777777777777777777777777777777777777"
            ],
            "nodeType": "bounded_task",
            "objective": "Write the deterministic goal artifact inside the governed workspace.",
            "retryPolicy": {
              "idempotencyKeyRequired": true,
              "maxAttempts": 1,
              "retryableFailureClasses": []
            },
            "runtimeRef": "runtime/local-goal@sha256:eeeeeeeeeeeeeeeeeeeeeeeeeeeeeeeeeeeeeeeeeeeeeeeeeeeeeeeeeeeeeeee",
            "sideEffect": "idempotent",
            "terminalGoalVerification": false,
            "timeoutSeconds": 60
          },
          {
            "budgetRequest": {
              "maxCostUsd": 0.0,
              "maxModelCalls": 1,
              "maxSpawnedNodes": 0,
              "maxToolCalls": 1,
              "maxWallSeconds": 30
            },
            "capabilityRequests": [],
            "claimRefs": [
              "CLM-GOAL-COMPLETE",
              "CLM-WRITE-ARTIFACT"
            ],
            "dependsOn": [
              "NODE-write-artifact"
            ],
            "expectedOutputs": [],
            "gateRefs": [
              "GATE-goal-complete"
            ],
            "id": "NODE-goal-verification",
            "inputRefs": [
              "NODE-write-artifact"
            ],
            "nodeType": "goal_verification",
            "objective": "Verify the deterministic GoalExecution completion claim.",
            "retryPolicy": {
              "idempotencyKeyRequired": false,
              "maxAttempts": 1,
              "retryableFailureClasses": []
            },
            "runtimeRef": "runtime/local-goal@sha256:eeeeeeeeeeeeeeeeeeeeeeeeeeeeeeeeeeeeeeeeeeeeeeeeeeeeeeeeeeeeeeee",
            "sideEffect": "idempotent",
            "terminalGoalVerification": true,
            "timeoutSeconds": 30
          }
        ],
        "rationale": "Minimal deterministic generic GoalExecution smoke path."
      }
    },
    "planner": {
      "adapterRef": "planner/inline-plan-draft@sha256:bbbbbbbbbbbbbbbbbbbbbbbbbbbbbbbbbbbbbbbbbbbbbbbbbbbbbbbbbbbbbbbb"
    },
    "profileRef": "profile/m1-real-executor@sha256:9999999999999999999999999999999999999999999999999999999999999999",
    "registry": {
      "allowedCapabilities": [
        "filesystem.write"
      ],
      "gateRefs": {
        "GATE-goal-complete": "sha256:4444444444444444444444444444444444444444444444444444444444444444",
        "GATE-write-artifact": "sha256:3333333333333333333333333333333333333333333333333333333333333333"
      },
      "nodeTypes": {
        "bounded_task": "sha256:1111111111111111111111111111111111111111111111111111111111111111",
        "goal_verification": "sha256:2222222222222222222222222222222222222222222222222222222222222222"
      },
      "runtimeRefs": {
        "runtime/local-goal@sha256:eeeeeeeeeeeeeeeeeeeeeeeeeeeeeeeeeeeeeeeeeeeeeeeeeeeeeeeeeeeeeeee": "sha256:eeeeeeeeeeeeeeeeeeeeeeeeeeeeeeeeeeeeeeeeeeeeeeeeeeeeeeeeeeeeeeee"
      }
    },
    "runtime": {
      "digest": "sha256:eeeeeeeeeeeeeeeeeeeeeeeeeeeeeeeeeeeeeeeeeeeeeeeeeeeeeeeeeeeeeeee",
      "runtimeRef": "runtime/local-goal@sha256:eeeeeeeeeeeeeeeeeeeeeeeeeeeeeeeeeeeeeeeeeeeeeeeeeeeeeeeeeeeeeeee"
    },
    "store": {
      "kind": "sqlite",
      "path": "D:\\ahra-v0.1-starter\\work\\tasks\\TASK-0040\\evidence\\real-agent-pilot\\mode-b\\run-01\\.ahra\\goal-control.sqlite3"
    },
    "workspaceRef": "D:\\ahra-v0.1-starter\\work\\tasks\\TASK-0040\\evidence\\real-agent-pilot\\mode-b\\run-01\\workspace"
  }
}
