{
  "apiVersion": "ahra.dev/v1alpha1",
  "kind": "GoalExecutionRequest",
  "metadata": {
    "idempotencyKey": "TASK-0045-MODE-C-R02",
    "name": "TASK-0045-MODE-C-R02",
    "requestId": "TASK-0045-MODE-C-R02"
  },
  "spec": {
    "artifactDir": "D:\\ahra-v0.1-starter\\work\\tasks\\TASK-0045\\evidence\\real-agent-pilot\\mode-c\\run-02\\.ahra\\artifacts",
    "execution": {
      "branch": "main",
      "maxConcurrency": 1,
      "maxRepairCycles": 0
    },
    "executor": {
      "adapterRef": "executor/bounded-task-agent-driver@sha256:6666666666666666666666666666666666666666666666666666666666666666"
    },
    "gateRunner": {
      "adapterRef": "gate-runner/deterministic@sha256:dddddddddddddddddddddddddddddddddddddddddddddddddddddddddddddddd"
    },
    "goal": {
      "claimGraphDigest": "sha256:6666666666666666666666666666666666666666666666666666666666666666",
      "claimGraphRef": "claim-graph/m1-generic-smoke",
      "goalDigest": "sha256:5555555555555555555555555555555555555555555555555555555555555555",
      "goalRef": "GOAL-M1-GENERIC-SMOKE",
      "requiredClaimRefs": [
        "CLM-GOAL-COMPLETE",
        "CLM-WRITE-ARTIFACT"
      ]
    },
    "planDraft": {
      "apiVersion": "ahra.dev/v1alpha1",
      "kind": "PlanDraft",
      "metadata": {
        "goalId": "GOAL-M1-GENERIC-SMOKE",
        "proposedBy": "planner/agent-driver@sha256:868b6967bf3f8d448634a0a79ab14661089ebcc1f08b969c1f2054deb75929db"
      },
      "spec": {
        "nodes": [
          {
            "budgetRequest": {
              "maxCostUsd": 0.0,
              "maxModelCalls": 1,
              "maxSpawnedNodes": 0,
              "maxToolCalls": 1,
              "maxWallSeconds": 30
            },
            "capabilityRequests": [
              {
                "capability": "filesystem.write",
                "resources": [
                  "outputs/summary.txt"
                ]
              }
            ],
            "claimRefs": [
              "CLM-WRITE-ARTIFACT"
            ],
            "dependsOn": [],
            "expectedOutputs": [
              {
                "artifactRequired": true,
                "consumerNodeRefs": [
                  "NODE-goal-verification"
                ],
                "deliveryRole": "artifact",
                "name": "deterministic-smoke-artifact",
                "schemaRef": "schema/m1-deterministic-artifact@sha256:8888888888888888888888888888888888888888888888888888888888888888"
              }
            ],
            "gateRefs": [
              "GATE-write-artifact"
            ],
            "id": "NODE-write-artifact",
            "inputRefs": [
              "GOAL-M1-GENERIC-SMOKE",
              "profile/m1-real-combined@sha256:8888888888888888888888888888888888888888888888888888888888888888"
            ],
            "nodeType": "bounded_task",
            "objective": "Create the required deterministic smoke artifact in the governed workspace using the supplied filesystem.write capability intent.",
            "retryPolicy": {
              "idempotencyKeyRequired": true,
              "maxAttempts": 1,
              "retryableFailureClasses": []
            },
            "runtimeRef": "runtime/local-goal@sha256:eeeeeeeeeeeeeeeeeeeeeeeeeeeeeeeeeeeeeeeeeeeeeeeeeeeeeeeeeeeeeeee",
            "sideEffect": "idempotent",
            "terminalGoalVerification": false,
            "timeoutSeconds": 30
          },
          {
            "budgetRequest": {
              "maxCostUsd": 0.0,
              "maxModelCalls": 1,
              "maxSpawnedNodes": 0,
              "maxToolCalls": 1,
              "maxWallSeconds": 30
            },
            "capabilityRequests": [],
            "claimRefs": [
              "CLM-GOAL-COMPLETE",
              "CLM-WRITE-ARTIFACT"
            ],
            "dependsOn": [
              "NODE-write-artifact"
            ],
            "expectedOutputs": [],
            "gateRefs": [
              "GATE-goal-complete"
            ],
            "id": "NODE-goal-verification",
            "inputRefs": [
              "GOAL-M1-GENERIC-SMOKE",
              "NODE-write-artifact"
            ],
            "nodeType": "goal_verification",
            "objective": "Verify that the artifact evidence satisfies CLM-WRITE-ARTIFACT and supports CLM-GOAL-COMPLETE under the supplied gate.",
            "retryPolicy": {
              "idempotencyKeyRequired": false,
              "maxAttempts": 1,
              "retryableFailureClasses": []
            },
            "runtimeRef": "runtime/local-goal@sha256:eeeeeeeeeeeeeeeeeeeeeeeeeeeeeeeeeeeeeeeeeeeeeeeeeeeeeeeeeeeeeeee",
            "sideEffect": "idempotent",
            "terminalGoalVerification": true,
            "timeoutSeconds": 30
          }
        ],
        "rationale": "Use one bounded filesystem write task to produce the smoke artifact, then one terminal goal verification node gated by the supplied goal-complete gate."
      }
    },
    "planner": {
      "adapterRef": "planner/agent-driver-plan-draft@sha256:7777777777777777777777777777777777777777777777777777777777777777"
    },
    "profileRef": "profile/m1-real-combined@sha256:8888888888888888888888888888888888888888888888888888888888888888",
    "registry": {
      "allowedCapabilities": [
        "filesystem.write"
      ],
      "gateRefs": {
        "GATE-goal-complete": "sha256:4444444444444444444444444444444444444444444444444444444444444444",
        "GATE-write-artifact": "sha256:3333333333333333333333333333333333333333333333333333333333333333"
      },
      "nodeTypes": {
        "bounded_task": "sha256:1111111111111111111111111111111111111111111111111111111111111111",
        "goal_verification": "sha256:2222222222222222222222222222222222222222222222222222222222222222"
      },
      "runtimeRefs": {
        "runtime/local-goal@sha256:eeeeeeeeeeeeeeeeeeeeeeeeeeeeeeeeeeeeeeeeeeeeeeeeeeeeeeeeeeeeeeee": "sha256:eeeeeeeeeeeeeeeeeeeeeeeeeeeeeeeeeeeeeeeeeeeeeeeeeeeeeeeeeeeeeeee"
      }
    },
    "runtime": {
      "digest": "sha256:eeeeeeeeeeeeeeeeeeeeeeeeeeeeeeeeeeeeeeeeeeeeeeeeeeeeeeeeeeeeeeee",
      "runtimeRef": "runtime/local-goal@sha256:eeeeeeeeeeeeeeeeeeeeeeeeeeeeeeeeeeeeeeeeeeeeeeeeeeeeeeeeeeeeeeee"
    },
    "store": {
      "kind": "sqlite",
      "path": "D:\\ahra-v0.1-starter\\work\\tasks\\TASK-0045\\evidence\\real-agent-pilot\\mode-c\\run-02\\.ahra\\goal-control.sqlite3"
    },
    "workspaceRef": "D:\\ahra-v0.1-starter\\work\\tasks\\TASK-0045\\evidence\\real-agent-pilot\\mode-c\\run-02\\workspace"
  }
}
